{
  "body": {
    "content": "## 定义\n磁偏角是指地球表面水平放置的指南针静止时，其N极所指的方向与地球北极（地理北极）方向之间的夹角。\n\n## 核心解释\n该物理参数的产生源于地磁两极与地理两极的不完全重合。地球周围存在一个大范围的磁场，在地磁场的作用下，指南针会调整方向使其N极指向地磁南极，而地磁南极实际上位于地理北极附近[evidence:auto-384ad7f6185b]。由于地磁轴和地球自转轴之间的夹角约为11°，导致指南针指示的磁北方向与真实的地理北极方向产生偏差，这一偏差即为磁偏角[evidence:auto-64d2da18ec9f]。\n\n## 关键要点\n- **测量条件**：指南针必须保持水平放置且处于静止状态。\n- **时空变化性**：磁偏角并非固定常数，它会随着观测者所在的地理位置不同而变化，并且会随时间推移发生缓慢改变。\n\n## 导航与历史关联\n磁场是物质的一种形态，但这类物质形态并不能像实物一样为人类的感官直接觉察[evidence:auto-cc627c99b34a]。人类早期利用主要成分为四氧化三铁的天然磁石制成了“司南”[evidence:auto-421d4fecb09a]，这是世界上最早使用的指南针[evidence:auto-1e97b1711d7a]。在实际定向与导航中，由于磁偏角的存在，需根据具体位置的夹角对指南针读数进行修正，以获取准确的地理方位。",
    "created_at": "2026-06-29T05:47:54+00:00",
    "format": "markdown",
    "generated_from": "model_generation",
    "media_refs": [],
    "node_id": "property/物理参数:auto-a53d034b90ec",
    "properties": {
      "card_title": "磁偏角",
      "evidence_count": 8,
      "model": "[external-path-redacted]",
      "prompt_version": "node-body-writer-v1",
      "source": "model_node_body"
    },
    "source_refs": [
      "evidence:auto-384ad7f6185b",
      "evidence:auto-64d2da18ec9f",
      "evidence:auto-cc627c99b34a",
      "evidence:auto-421d4fecb09a",
      "evidence:auto-1e97b1711d7a"
    ],
    "status": "active",
    "updated_at": "2026-06-29T05:47:54+00:00"
  },
  "card": {
    "created_at": "2026-06-29T05:47:51+00:00",
    "dataset_id": "main",
    "framework_refs": [],
    "id": "node-card:auto-d5ebd1a78067",
    "mention_refs": [],
    "node_id": "property/物理参数:auto-a53d034b90ec",
    "pattern_refs": [],
    "profile_refs": [],
    "properties": {
      "backfilled": true,
      "extraction_template": {
        "id": "textbook/physics",
        "name": "物理教材抽取模板",
        "version": 1
      }
    },
    "sections": [
      {
        "content": [
          "地球表面水平放置的指南针静止时N极所指的方向与地球北极（地理北极）方向之间的夹角。"
        ],
        "id": "definition",
        "properties": {
          "backfilled": true
        },
        "section_type": "definition",
        "source_refs": [
          "evidence:auto-cc627c99b34a"
        ],
        "title": "定义"
      },
      {
        "content": [
          "地球表面水平放置的指南针静止时N极所指的方向与地球北极（地理北极）方向之间的夹角。"
        ],
        "id": "essence",
        "properties": {
          "backfilled": true
        },
        "section_type": "essence",
        "source_refs": [
          "evidence:auto-cc627c99b34a"
        ],
        "title": "核心本质"
      },
      {
        "content": [
          "地球表面水平放置的指南针静止时N极所指的方向与地球北极（地理北极）方向之间的夹角。"
        ],
        "id": "key-points",
        "properties": {
          "backfilled": true
        },
        "section_type": "key_points",
        "source_refs": [
          "evidence:auto-cc627c99b34a"
        ],
        "title": "关键要点"
      },
      {
        "content": [
          "磁偏角"
        ],
        "id": "example",
        "properties": {
          "backfilled": true
        },
        "section_type": "example",
        "source_refs": [
          "evidence:auto-cc627c99b34a"
        ],
        "title": "示例"
      },
      {
        "content": [
          "磁现象 磁感线"
        ],
        "id": "application",
        "properties": {
          "backfilled": true
        },
        "section_type": "application",
        "source_refs": [
          "evidence:auto-cc627c99b34a"
        ],
        "title": "应用"
      },
      {
        "content": [
          "需结合证据原文确认适用范围。"
        ],
        "id": "misconception",
        "properties": {
          "backfilled": true
        },
        "section_type": "misconception",
        "source_refs": [
          "evidence:auto-cc627c99b34a"
        ],
        "title": "常见误解"
      }
    ],
    "source_refs": [
      "evidence:auto-cc627c99b34a"
    ],
    "status": "active",
    "summary": "地球表面水平放置的指南针静止时N极所指的方向与地球北极（地理北极）方向之间的夹角。",
    "title": "磁偏角",
    "updated_at": "2026-06-29T05:47:51+00:00"
  },
  "completeness": {
    "passed": 9,
    "score": 100,
    "signals": [
      {
        "key": "node_definition",
        "label": "节点定义",
        "message": "节点有可读定义。",
        "passed": true,
        "severity": "required"
      },
      {
        "key": "semantic_core",
        "label": "语义核心",
        "message": "节点包含 semantic_core 语义骨架。",
        "passed": true,
        "severity": "recommended"
      },
      {
        "key": "relations",
        "label": "对象关系",
        "message": "节点已有入边或出边。",
        "passed": true,
        "severity": "recommended"
      },
      {
        "key": "evidence",
        "label": "证据",
        "message": "节点有证据支撑。",
        "passed": true,
        "severity": "required"
      },
      {
        "key": "source_fragments",
        "label": "原文片段",
        "message": "节点能追溯到原文片段。",
        "passed": true,
        "severity": "recommended"
      },
      {
        "key": "domain_profiles",
        "label": "领域画像",
        "message": "节点有领域、学段或课程角色信息。",
        "passed": true,
        "severity": "required"
      },
      {
        "key": "body_source_refs",
        "label": "正文引用",
        "message": "知识正文包含 source_refs。",
        "passed": true,
        "severity": "recommended"
      },
      {
        "key": "card_summary",
        "label": "结构化卡片",
        "message": "节点有结构化摘要或卡片分节。",
        "passed": true,
        "severity": "recommended"
      },
      {
        "key": "mentions",
        "label": "来源提及",
        "message": "节点有来源提及记录。",
        "passed": true,
        "severity": "required"
      }
    ],
    "total": 9
  },
  "domain_profiles": [
    {
      "created_at": "2026-06-29T05:47:51+00:00",
      "curriculum_roles": [
        "core"
      ],
      "dataset_id": "main",
      "domain": "general",
      "id": "domain-profile:auto-4f904541f856",
      "node_id": "property/物理参数:auto-a53d034b90ec",
      "notes": "Backfilled because the model omitted a domain profile.",
      "properties": {
        "backfilled": true,
        "extraction_template": {
          "id": "textbook/physics",
          "name": "物理教材抽取模板",
          "version": 1
        },
        "grade_band": "grade-11",
        "pedagogical_profiles_by_stage": {
          "senior-secondary": {
            "assessment_tasks": [
              "提供某地水平静止指南针的方位俯视图，要求使用量角器测量并计算该地的磁偏角大小。",
              "给出地磁场两极与地理两极的相对位置图，要求指出指南针N极的实际指向并解释其与正北方向产生夹角的原因。",
              "列举导致同一地点磁偏角数值发生改变的两个因素，并结合教材边界条件撰写简要分析说明。"
            ],
            "common_errors": [
              "混淆地磁北极与地理北极的概念，误认为指南针N极始终严格指向地理北极。",
              "忽略“指南针水平放置且静止”的操作前提，在指针摆动或未调平时强行记录数据。",
              "将磁偏角视为固定不变的物理常量，未能理解其随地理位置不同和随时间缓慢变化的边界特征。"
            ],
            "diagnostic_questions": [
              "若在某地水平放置指南针且待其完全静止，发现N极指向与正北方向夹角为5°向东，该地的磁偏角是多少？判断依据是什么？",
              "为什么说地磁北极和地理北极并不重合？指南针N极实际指向的是哪个磁极？",
              "在同一地点观测，为什么不同年份记录的磁偏角数值可能存在差异？"
            ],
            "difficulty_level": "basic",
            "extension_suggestions": [
              "结合导航与测绘实例，讨论磁偏角对实际定向精度的影响及校正方法。",
              "探究地磁极倒转假说中“流动方向倒转”对地表磁偏角长期演变的潜在影响。",
              "对比不同历史时期（如司南时期与现代）同一地点的磁偏角记录，建立物理量随时间演变的科学观念。"
            ],
            "generation": {
              "confidence": 0.99,
              "generated_at": "2026-07-12T10:12:46+00:00",
              "generated_from": "model_generation",
              "input_fingerprint": "6fe53bf74d9e545fa06bbd5e7b9273205651e0ec11e3fde38f4b8f2059105eeb",
              "model": "[external-path-redacted]",
              "prompt_version": "pedagogical-profile-v1",
              "review_status": "pending",
              "source_refs": [
                "evidence:auto-64d2da18ec9f",
                "evidence:auto-384ad7f6185b",
                "evidence:auto-2f6869caa44c"
              ]
            },
            "grade_band": "grade-11",
            "learning_objectives": [
              "能准确陈述磁偏角的定义，并明确指出观测时必须满足“指南针水平放置且静止”的条件。",
              "能在空间示意图中正确区分地理北极与地磁南极的位置关系，并准确标出磁偏角。",
              "能结合地磁轴与自转轴夹角证据，说明磁偏角随地理位置和时间缓慢变化的特性。"
            ],
            "remediation_suggestions": [
              "利用指南针实物开展规范操作演示，强调“水平”与“静止”的观测标准，帮助学生建立直观的夹角认知。",
              "依据“地磁轴和地球自转轴之间的夹角约为11°”的证据绘制地球剖面图，直观对比两极错位关系以突破空间想象难点。",
              "设计跨地域或跨年代的磁偏角数据对比表格，引导学生在分析中自主归纳磁偏角的动态变化边界。"
            ],
            "school_stage": "senior-secondary"
          }
        },
        "subject": "physics"
      },
      "school_stages": [
        "senior-secondary"
      ],
      "source_refs": [
        "evidence:auto-2f6869caa44c",
        "evidence:auto-384ad7f6185b",
        "evidence:auto-64d2da18ec9f",
        "evidence:auto-cc627c99b34a"
      ],
      "status": "active",
      "updated_at": "2026-07-12T10:12:46+00:00"
    }
  ],
  "evidence": [
    {
      "anchor_ref": "struct:physics-hukj-compulsory-3:chunk:11-1-a",
      "created_at": "2026-06-29T05:47:51+00:00",
      "dataset_id": "main",
      "excerpt": "利用磁石制成的 “司南” 是世界上最早使用的指南针。",
      "extraction_method": "openai_chat_completions",
      "id": "evidence:auto-1e97b1711d7a",
      "locator": "line:10",
      "modality": "text",
      "normalized_claims": [
        "利用磁石制成的 “司南” 是世界上最早使用的指南针。"
      ],
      "page_end": 99,
      "page_start": 96,
      "properties": {
        "extraction_template": {
          "id": "textbook/physics",
          "name": "物理教材抽取模板",
          "version": 1
        }
      },
      "source_id": "physics-hukj-compulsory-3",
      "source_path": "data/mineru/physics-hukj-compulsory-3/full.md",
      "source_type": "textbook",
      "updated_at": "2026-06-29T05:47:51+00:00"
    },
    {
      "anchor_ref": "struct:physics-hukj-compulsory-3:chunk:11-1-a",
      "created_at": "2026-06-29T05:47:51+00:00",
      "dataset_id": "main",
      "excerpt": "![](images/679274bb599c58123128fcb49b4b0b9e3363227dbcd3798d2f0d597620ad3f3d.jpg)",
      "extraction_method": "markdown_hint",
      "id": "evidence:auto-2f6869caa44c",
      "locator": "line:84",
      "modality": "image",
      "normalized_claims": [
        "![](images/679274bb599c58123128fcb49b4b0b9e3363227dbcd3798d2f0d597620ad3f3d.jpg)"